Product Name,Section,Price,Discount,Rating
Blubby Multi Clutcher ( Pack of 1 ),Accessories,213,78.68,0
Ezybe Self Adhesive Kichen Shelf Light Blue Plastic Storage Racks (Pack of 2),Accessories,173,82.68,0
AUTOGROOMZ Windshield Only Double Clamp Car Mobile Holder - Black,Accessories,217,81.9,0
QitmirMKT NEW KEYCHAIN LIGHTER WITH HIGH POWER LIGHT Multicolor Multipurpose Car Cigarette Lighter ( Pack of 1 ),Accessories,238,76.18,0
GEEO Accu Pressure Bead Back / Lumbar Support Single Black,Accessories,223,77.68,0
"delhideals Indian Flag for Car Dashboard, Office Table, Study Table & Drawing Table",Accessories,195,67.45,0
"5 In 1 Multi Pin Universal Portable Adapter And Car Mobile Charging Cable For (iPhone,Type C and Micro USB)",Accessories,254,74.57,0
Aksmit Premium Metal Key Cover Compitable for Maruti Suzuki Ignis,Accessories,434,56.56,0
"Aksmit Waterproof and Non-slip Leather Floor Mats, Car Floor Mat Accessories, Black gold",Accessories,1472,13.36,0
CRAYLUXE Accu Pressure Bead Back / Lumbar Support Single Black,Accessories,538,64.11,0
Tender care Memory Foam Back / Lumbar Support Single Black,Accessories,353,76.45,0
"USB Disco Light / Night Light / Room / Car / Party Decoration Disco Laser Car Fancy Lights, Car Roof Full Star Projection Car Fancy Lights Portable Decorations Lamp",Accessories,184,69.28,0
RONISH Steering Cover Leatherite,Accessories,395,60.46,0
"GEEO Universal Car Steering Knob, Car Steering Wheel Knob, Steering Wheel Spinner Knob, 360° Rotation Booster (3R Original)",Accessories,331,66.87,0
JAGIRA DIVINE TOUCH Multicolor Plastic Storage Racks ( Pack of 1 ),Accessories,116,83.4,0
Aksmit 4 Pieces 12 LED DC 12V Multicolour Music Car Strip Atmosphere Lamp Light for Car Interior Under Dash Lighting Kit with Sound Active Function and Wireless Control,Accessories,338,51.65,0
Vertical9 Car Mobile Charger 3_in_1 cable Multicolour,Accessories,240,78.16,0
Blubby Multi Rubber Band ( Pack of 30 ),Accessories,135,83.1,0
AKSMIT Dashboard Fan Black,Accessories,508,27.32,0
Digital Car Dashboard Alarm Clock and Stopwatch With Flexible Stand,Accessories,180,54.89,0
Anshri White Plastic Storage Racks ( Pack of 4 ),Accessories,250,74.97,0
mahek accessories for Headrest Black,Accessories,137,86.29,0
"TANTRA Car Armrest Cover Cushion with 2 Storage Bags - Soft, Comfortable, Non-Slip Protector for Vehicle Center Console - Waterproof, Durable, and Stylish",Accessories,365,63.46,0
Bhavyta Night Vision Visor Plastic Yellow,Accessories,441,55.86,0
"TANTRA Car Armrest Cover Cushion with 2 Storage Bags - Soft, Comfortable, Non-Slip Protector for Vehicle Center Console - Waterproof, Durable, and Stylish",Accessories,365,63.46,0
Sonal Brown Plastic Storage Racks ( Pack of 1 ),Accessories,500,37.89,0
AKSMIT Dashboard Fan Black,Accessories,586,26.66,0
Anshri White Plastic Kitchen Dispenser ( Pack of 2 ),Accessories,167,66.53,0
"Premium Car Seat Belt Cover - Comfort & Safety Enhancer - Adjustable, Soft, & Stylish - Universal Fit for All Vehicles",Accessories,278,72.17,0
Car Ashtrays Multi Color,Accessories,176,74.82,0
4 Color 17 CM DRL Strip,Accessories,187,62.53,0
Sushil Silver Stainless Steel Dish Racks ( Pack of 1 ),Accessories,299,70.07,0
JISUN Chakla Belan Stand Silver Stainless Steel Rolling Pin Holder ( Pack of 1 ),Accessories,158,68.34,0
"Portronics Clamp M3 Adjustable Car Mobile Phone Holder Stand for Dashboard & Windshield, 360degree Rotational, Strong Suction Cup, Compatible with 4 to 6 inch Devices(Black)",Accessories,268,70.19,0
Sushil Silver Stainless Steel Cylinder Trolley ( Pack of 2 ),Accessories,545,63.64,0
Crust Laptop Charger / Inverter N80 Black,Accessories,1382,61.6,0
"Aksmit Pack of -1 Car Gear Knob Protector Gear Shifter Cover for Anti-Scratch Car Gear Knob Cover and Dust Proof Nonslip Gear Cover for Car Universal Fit Silicon Car Gear Knob Stylish- Black, Silicone Rubber",Accessories,187,53.13,0
RONISH Steering Cover Leatherite,Accessories,446,55.36,0
"Portronics Car Power 5 Car Charger with Dual USB Ports ,Black (POR 1345) wihtout cable",Accessories,204,59.12,0
Winstar - Silver Stainless Steel Wall mount Stand ( Pack of 1 ),Accessories,790,73.66,0
AROTEK Grey Men's Daily Slipper,Footwear,191,76.1,0
Xtoon Grey Men's Outdoor Shoes,Footwear,498,66.78,0
Cozy Wear Brown Men's Daily Slipper,Footwear,193,61.32,0
Stylestry Black Women's Flats,Footwear,423,78.84,0
Commander Shoes Black Women's Pumps Heels,Footwear,605,75.79,0
PERY PAO Blue Men's Slide Flip Flop,Footwear,226,77.38,0
Aadi Black Men's Derby Formal Shoes,Footwear,452,77.39,0
FUSEOWL Maroon Women's Flip Flop,Footwear,171,82.88,0
Cozy Wear Black Men's Daily Slipper,Footwear,183,63.33,0
YNP Design Collections Brown Women's Ethnic Ballerinas,Footwear,411,17.64,0
Seafoot White Men's Outdoor Shoes,Footwear,317,68.27,0
BEE U NIK Black Men's Thong Flip Flop,Footwear,176,64.73,0
hanuco Height Increasing Insoles,Footwear,318,68.17,0
Radhe Creation Cream Polish Suitable for Black Color,Footwear,197,67.11,0
Cozy Wear Olive Men's Daily Slipper,Footwear,193,61.32,0
Skindora Cream Polish Suitable for MultiColor Color,Footwear,189,68.45,0
Citipiti ind. Green Women's Flats,Footwear,208,70.24,0
LiteHawks Green Men's Daily Slipper,Footwear,220,77.98,0
Cozy Wear Black Men's Daily Slipper,Footwear,214,57.11,0
WildProducts All Type Shoes Cleaner,Footwear,148,85.19,0
lyvi Black Men's Daily Slipper,Footwear,187,79.2,0
Xtoon Multi Color Men's Korean Shoes,Footwear,548,63.44,0
Stylestry Maroon Women's Flats,Footwear,353,64.66,0
Dream Makers - Black Women's Sandal Heels,Footwear,407,72.85,0
YOU LIkE Brown Men's Derby Formal Shoes,Footwear,693,80.19,0
FUSEOWL Light Grey Women's Toe Covered Flip Flop,Footwear,250,74.97,0
Jumpback Peach Women's Casual Ballerinas,Footwear,240,75.98,0
Bersache - Orange Girl's Sports Shoes ( 1 Pair ),Footwear,520,73.99,0
Bersache - Light Grey Boy's Clogs ( 1 Pair ),Footwear,364,81.79,0
Campus Oxyfit (N) Navy Blue Men's Slip-on Shoes,Footwear,622,37.74,0
Densu Black Men's Korean Shoes,Footwear,597,60.17,0
ZYPSO Zypso Men?s Grey Synthetic Grey Men's Lifestyle Shoes,Footwear,559,72.04,0
PENNEN White Men's Lifestyle Shoes,Footwear,552,44.74,0
NEOBABY Casual Clog for Kids Boys and Girls(Pack of 2),Footwear,210,78.98,0
"ADISO Trendy ,outdoor stylish casual White Men's Outdoor Shoes",Footwear,597,80.09,0
PENNEN White Men's Lifestyle Shoes,Footwear,393,60.66,0
KHADIM Beige Flats,Footwear,480,31.33,0
Paduki Gray Women's Flats,Footwear,308,55.94,0
Citipiti ind. Gray Women's Flats,Footwear,208,70.24,0
PENNEN Gray Women's Floater Sandals,Footwear,312,68.77,0
MAAN Black Women's Gladiators Flats,Footwear,216,78.38,0
Dream Makers - Black Women's Sandal Heels,Footwear,407,72.85,0
YOU LIkE - Brown Men's Derby Formal Shoes,Footwear,694,76.86,0
FUSEOWL Purple Women's Toe Covered Flip Flop,Footwear,278,72.17,0
Shoetopia Black Women's Casual Ballerinas,Footwear,376,62.36,0
secritas Boys & Girls Slip On Slipper Flip Flop,Footwear,182,81.78,0
RITA-KIDS-HAWAI-MINIPANDA5STUDD-SLIPPER,Footwear,177,57.76,0
Altek PeachPuff Women's Flats,Footwear,244,51.1,0
Aeroblu Footwear Copper Women's Open Toe Flats,Footwear,331,33.67,0
Stylestry Silver Women's Flats,Footwear,447,77.64,0
Paduki Silver Women's Flats,Footwear,277,60.37,0
PENNEN Green Women's Flats,Footwear,270,66.21,0
Paduki Gold Women's Flats,Footwear,280,59.94,0
HANSWING All Type Shoes Cleaner,Footwear,148,81.48,0
PENNEN Blue Women's Flats,Footwear,270,66.21,0
Stylestry Tan Women's Flats,Footwear,423,78.84,0
Altek Peach Women's Flats,Footwear,263,73.67,0
Shoetopia Black Women's Flats,Footwear,518,74.09,0
Altek Silver Women's Flats,Footwear,296,70.37,0
NEOBABY Casual Clog for Kids Boys and Girls(Pack of 2),Footwear,211,78.88,0
Cool and NIce kids Multi color Bermuda pack of 5,Kids Fashion,341,43.07,0
"A.W.A KIDS FASHION Cotton Frock For Girls ( Pack of 1 , Blue )",Kids Fashion,382,45.35,0
"A.W.A KIDS FASHION Cotton Blend Frock For Girls ( Pack of 1 , Light Blue )",Kids Fashion,382,61.76,0
"Arshia Fashions Cotton Blend Shirt Dress For Girls ( Pack of 1 , Blue )",Kids Fashion,501,74.94,0
"Arshia Fashions Girls Cotton Blend Patiala Kurta Set ( Pack of 1 , Green )",Kids Fashion,561,77.55,0
"Villata fashion Net Frock For Girls ( Pack of 1 , White )",Kids Fashion,275,72.47,0
"Nios Fashion Girls Cotton Polyester Jeans ( Pack of 2 , Multicolor 4 )",Kids Fashion,355,60.51,0
"PMD Fashion Net Lehenga Choli Set For Girls ( Pack of 1 , Charcoal )",Kids Fashion,355,64.46,0
"Arshia Fashions Polyester Shirt Dress For Girls ( Pack of 1 , Multicolor )",Kids Fashion,561,71.94,0
KIDS CLUB Pack of 1 Boys 100% Cotton Full Sleeves Shirt ( Green ),Kids Fashion,355,72.67,0
"Villata fashion Net Frock For Girls ( Pack of 1 , Red )",Kids Fashion,290,70.97,0
"Arshia Fashions Net Lehenga Choli Set For Girls ( Pack of 1 , Green )",Kids Fashion,620,74.16,0
NI FASHION Pack of 1 Boys Cotton Blend T-Shirt ( Green ),Kids Fashion,171,65.73,0
"Arshia Fashions Cotton Blend Dress For Girls ( Pack of 1 , Multicolor )",Kids Fashion,561,71.94,0
"Villata fashion Net Frock For Girls ( Pack of 1 , Red )",Kids Fashion,331,66.87,0
NAYPAL FASHION STYLE Pack of 1 Boys & Girls Cotton Blend T-Shirt ( Pink ),Kids Fashion,233,76.68,0
"Vidya Fashions Net Frock For Girls ( Pack of 1 , Pink )",Kids Fashion,482,62.89,0
"Villata fashion Net Frock For Girls ( Pack of 1 , Red )",Kids Fashion,281,71.87,0
"Arshia Fashions Polyester Blend Frock For Girls ( Pack of 1 , Red )",Kids Fashion,321,78.59,0
"samjho fashion Net Frock For Baby Girls ( Pack of 1 , Green )",Kids Fashion,320,59.95,0
"Villata fashion Net Frock For Girls ( Pack of 1 , Blue )",Kids Fashion,275,72.47,0
"Arshia Fashions Net Lehenga Choli Sets For Girls ( , Red )",Kids Fashion,381,84.12,0
"SUBRUNG FASHION Crepe Frock For Baby Girls ( Pack of 1 , Multicolor 1 )",Kids Fashion,389,75.69,0
"Nios Fashion Girls Cotton Polyester Jeans ( Pack of 2 , Multicolor 2 )",Kids Fashion,355,60.51,0
"Dhvra Fashion Girls Crepe Kurti with Palazzo ( Pack of 1 , BLUE )",Kids Fashion,482,51.75,0
KIDS CLUB Pack of 1 Boys 100% Cotton Full Sleeves Shirt ( Peach ),Kids Fashion,336,74.13,0
"Villata fashion Net Frock For Girls ( Pack of 1 , White )",Kids Fashion,265,73.47,0
"Arshia Fashions Net Frock For Girls ( Pack of 1 , Light Blue )",Kids Fashion,381,78.82,0
NI FASHION Pack of 1 Boys Cotton Blend T-Shirt ( Light Green ),Kids Fashion,171,65.73,0
"PMD Fashion Net Lehenga Choli Set For Girls ( Pack of 1 , Wine )",Kids Fashion,355,64.46,0
"Villata fashion Net Frock For Girls ( Pack of 1 , Red )",Kids Fashion,331,66.87,0
NI FASHION Pack of 1 Boys Cotton Blend Polo T-Shirt ( White ),Kids Fashion,171,65.73,0
"Villata fashion Net Frock For Girls ( Pack of 1 , Red )",Kids Fashion,262,73.77,0
"A.W.A KIDS FASHION Cotton Blend Frock For Girls ( Pack of 1 , Green )",Kids Fashion,582,41.74,0
"Arshia Fashions Polyester Fit And Flare Dress For Girls ( Pack of 1 , Purple )",Kids Fashion,561,71.94,0
"samjho fashion Net Gown For Girls ( Pack of 1 , Pink )",Kids Fashion,149,85.09,0
KASEERA CUTE STYLISH AND TRENDING KIDS GYM VEST PACK OF 5,Kids Fashion,273,60.94,0
NI FASHION Pack of 1 Boys Cotton Blend T-Shirt ( Carrot Orange ),Kids Fashion,171,65.73,0
"A.W.A KIDS FASHION Cotton Blend Frock For Girls ( Pack of 1 , Pink )",Kids Fashion,382,61.76,0
"Nios Fashion Girls Cotton Polyester Jeans ( Pack of 2 , Multicolor 5 )",Kids Fashion,355,60.51,0
eddicted Polyester Men's Puffer Jacket - Blue ( Pack of 1 ),Men Clothing,582,55.2,0
TAZO Nylon Men's Windcheater Jacket - Blue ( Pack of 1 ),Men Clothing,462,66.98,0
AZF Nylon Men's Windcheater Jacket - Dark Grey ( Pack of 1 ),Men Clothing,457,71.42,0
Brandline Multi Cotton Men's Unstitched Shirts & Trousers ( Pack of 1 ),Men Clothing,582,70.89,0
Montrez Cotton Blend Men's Casual Jacket - White ( Pack of 1 ),Men Clothing,557,77.71,0
eddicted Polyester Men's Puffer Jacket - Navy Blue ( Pack of 1 ),Men Clothing,617,52.5,0
Christy World Polyester Men's Casual Jacket - Black ( Pack of 1 ),Men Clothing,570,77.19,0
Forbro Nylon Men's Windcheater Jacket - Black ( Pack of 1 ),Men Clothing,598,70.09,0
AZF Nylon Men's Windcheater Jacket - Olive ( Pack of 1 ),Men Clothing,457,71.42,0
eddicted Polyester Men's Windcheater Jacket - Maroon ( Pack of 1 ),Men Clothing,617,52.5,0
Camey Polyester Men's Casual Jacket - Green ( Pack of 1 ),Men Clothing,678,77.39,0
Mashaykh Polyester Men's Windcheater Jacket - White ( Pack of 1 ),Men Clothing,682,65.88,0
Forbro Nylon Men's Windcheater Jacket - Maroon ( Pack of 1 ),Men Clothing,598,70.09,0
Reya Cotton Blend Men's Casual Jacket - Maroon ( Pack of 1 ),Men Clothing,429,71.38,0
yellow tree Polyester Men's Casual Jacket - White ( Pack of 1 ),Men Clothing,704,71.83,0
Reya Cotton Blend Men's Casual Jacket - Black ( Pack of 1 ),Men Clothing,429,71.38,0
yellow tree Polyester Men's Casual Jacket - Multicolor ( Pack of 1 ),Men Clothing,722,63.88,0
FTX Denim Men's Denim Jacket - Light Blue ( Pack of 1 ),Men Clothing,557,75.23,0
Mashaykh Polyester Men's Windcheater Jacket - Multicolor 1 ( Pack of 1 ),Men Clothing,682,65.88,0
Christy World Nylon Men's Windcheater Jacket - Black ( Pack of 1 ),Men Clothing,617,75.31,0
Mashaykh Polyester Men's Windcheater Jacket - Black ( Pack of 1 ),Men Clothing,657,67.13,0
AZF Nylon Men's Casual Jacket - Wine ( Pack of 1 ),Men Clothing,457,71.42,0
Mashaykh Polyester Men's Windcheater Jacket - Multicolor 2 ( Pack of 1 ),Men Clothing,682,65.88,0
eddicted Nylon Men's Biker Jacket - Grey ( Pack of 1 ),Men Clothing,617,52.5,0
Rigo Polyester Men's Puffer Jacket - Grey ( Pack of 1 ),Men Clothing,690,82.75,0
Montrez Cotton Blend Men's Casual Jacket - Olive ( Pack of 1 ),Men Clothing,557,77.71,0
IF-INDIAN FORT Polyester Men's Quilted & Bomber Jacket - Navy ( Pack of 1 ),Men Clothing,658,60.72,0
yellow tree Polyester Men's Casual Jacket - Black ( Pack of 1 ),Men Clothing,685,72.59,0
FTX Polyester Men's Casual Jacket - Black ( Pack of 1 ),Men Clothing,457,77.14,0
eddicted Nylon Men's Puffer Jacket - Maroon ( Pack of 1 ),Men Clothing,617,52.5,0
AZF Nylon Men's Windcheater Jacket - Blue ( Pack of 1 ),Men Clothing,457,71.42,0
Rigo Fleece Men's Casual Jacket - Grey ( Pack of 1 ),Men Clothing,612,74.49,0
NUEVOSPORTA Denim Men's Denim Jacket - Blue ( Pack of 1 ),Men Clothing,622,84.45,0
AZF Nylon Men's Windcheater Jacket - Navy ( Pack of 1 ),Men Clothing,457,71.42,0
Montrez Cotton Blend Men's Casual Jacket - Yellow ( Pack of 1 ),Men Clothing,557,77.71,0
eddicted Polyester Men's Windcheater Jacket - Maroon ( Pack of 1 ),Men Clothing,617,52.5,0
MAYKR Polyester Men's Windcheater Jacket - White ( Pack of 1 ),Men Clothing,774,61.28,0
Forbro Nylon Men's Windcheater Jacket - White ( Pack of 1 ),Men Clothing,598,70.09,0
MAYKR Polyester Men's Windcheater Jacket - White ( Pack of 1 ),Men Clothing,774,61.28,0
TrendsTalk Nylon Men's Windcheater Jacket - Blue ( Pack of 1 ),Men Clothing,576,61.57,0
Sheetal associates Women Polyester Printed Fit & Flare Dress ( Blue ),Women Clothing,394,60.56,0
wanquila Women Lycra Solid Bodycon Dress ( Beige ),Women Clothing,363,85.47,0
"BLYNK Lycra Petticoat ( Maroon , )",Women Clothing,171,86.84,0
Sheetal associates Women Crepe Printed Fit & Flare Dress ( White ),Women Clothing,394,60.56,0
Fabverse Women Lycra Solid Bodycon Dress ( Black ),Women Clothing,319,78.72,0
Sheetal associates Women Crepe Printed A-line Dress ( Orange ),Women Clothing,339,66.07,0
"KNOWZY Rayon Women Dupatta ( Magenta , Pack of 1 )",Women Clothing,108,81.97,0
TUHIRAJ Women Crepe Printed Gown ( Brown ),Women Clothing,470,52.95,0
Sheetal associates Women Crepe Printed A-line Dress ( White ),Women Clothing,394,60.56,0
Madhusudan Women Rayon Printed Ethnic Dress ( Pink ),Women Clothing,452,76.2,0
Sheetal associates Women Polyester Printed Fit & Flare Dress ( Brown ),Women Clothing,394,60.56,0
JASH CREATION Women Cotton Blend Printed Fit & Flare Dress ( Pink ),Women Clothing,356,82.19,0
Sheetal associates Women Crepe Printed Shirt Dress ( White ),Women Clothing,394,60.56,0
THE LADIES FASHION Women Viscose Rayon Maxi ( White ),Women Clothing,391,75.55,0
Sheetal associates Women Crepe Printed Shirt Dress ( Green ),Women Clothing,394,60.56,0
NIVESTANA Women Viscose Rayon Gown ( Purple ),Women Clothing,393,75.42,0
COMFY ATTIRE White Cotton Women's Flared Skirt ( Pack of 1 ),Women Clothing,416,67.98,0
YUGAVEERAA Lycra Solid Regular Saree With Unstitched Blouse Piece ( Blue ),Women Clothing,299,66.25,0
Shri Hub Cotton Women White Salwar,Women Clothing,220,63.27,0
Vkaran Lycra Cut Outs Saree With Unstitched Blouse Piece ( Black ),Women Clothing,299,85.04,0
"BLYNK Lycra Petticoat ( Pink , )",Women Clothing,171,86.84,0
Sttoffa Maroon Cotton Women's A-Line Skirt ( Pack of 1 ),Women Clothing,568,62.11,0
PIYURZ Pack of 6 Poly Cotton Solid Women's Briefs ( Multi Color ),Women Clothing,207,73.76,0
Bulbul Gold Readymade without Pad Lycra Women's Blouse ( Pack of 1 ),Women Clothing,259,85.6,0
Fasanger Cotton Lycra Women's Shrugs - Blue ( ),Women Clothing,281,88.76,0
FIHA Womens Fishnet Bodystocking Crotchless Bodysuit Tights Soft Nightwear Lingerie,Women Clothing,276,44.69,0
"N-Gal Lycra Petticoat ( Black , )",Women Clothing,248,80.91,0
Tankirti Cotton Printed Women Regular Nighty ( Blue ),Women Clothing,323,89.23,0
DOOZIE LOVEPLUS Pack of 6 Poly Cotton Printed Women's Hipster ( Multicolor ),Women Clothing,204,79.58,0
Lecowar Women Fleece Hooded Sweatshirt For ( Maroon ),Women Clothing,424,77.67,0
KAFF Pack of 3 Cotton Blend Women Legging ( Multicolor ),Women Clothing,387,74.18,0
Ogarti Woollen Shrugs - Maroon,Women Clothing,539,58.51,0
color bucket Women Net Circular Semi Stitched Lehenga Choli ( Beige ),Women Clothing,377,81.14,0
"DELTIN HUB Lycra Petticoat ( White , )",Women Clothing,234,66.52,0
"DELTIN HUB Polyester Petticoat ( Blue , )",Women Clothing,234,66.52,0
ZWERLON Orange Polyester Women's Flared Skirt ( Pack of 1 ),Women Clothing,360,81.99,0
hakshlifestlye Pack of 3 Cotton Non Padded Everyday Bra For Women ( Multicolor ),Women Clothing,232,66.81,0
"Ladyland Cotton Hipster ( Multicolor , Pack of 3 )",Women Clothing,157,87.91,0
"DELTIN HUB Lycra Petticoat ( Black , )",Women Clothing,234,66.52,0
"kramox pack of 2 (72 pcs) trips Double Sided Tape for Fashion, Clothing and Body | All Day Strength Invisible Dress Tape for women | Gentle to stick on Skin and clothes | Transparent",Women Clothing,125,84.36,0
